{
  "$schema": "http://json-schema.org/draft-07/schema#",
  "title": "Antennas",
  "description": "A list of antenna master data variants (attack pattern / level-evolution stages) for a single antenna id, parsed into Anntena (lib/domain/master_data/anntena.dart). One file per antenna, under assets/data/antennas/attack|support|other/, each containing an array with one entry per selectable variant.",
  "type": "array",
  "items": {
    "type": "object",
    "additionalProperties": false,
    "required": ["id", "category"],
    "properties": {
      "id": {
        "type": "string",
        "description": "Stable identifier referenced by other data and code, and looked up in the app's localization resources for display text."
      },
      "category": {
        "type": "string",
        "enum": ["attack", "support", "other"],
        "description": "Which selection-dialog tab this variant is grouped under."
      },
      "targetCount": {
        "type": ["integer", "null"],
        "description": "Number of targets this antenna's move hits, or null/omitted if it hits every opposing target instead of a fixed count."
      },
      "targetsAll": {
        "type": "boolean",
        "description": "Whether this antenna's move hits every opposing target instead of a fixed count. Defaults to false."
      },
      "dealsDamage": {
        "type": "boolean",
        "description": "Whether this antenna's move deals damage. Defaults to false."
      },
      "attackAttributeIds": {
        "type": "array",
        "items": { "type": "string" },
        "description": "Attribute ids (see assets/data/attributes/) of the damage this antenna deals. Empty/omitted if it deals no attribute-typed damage. May contain more than one id."
      },
      "isInheritable": {
        "type": "boolean",
        "description": "Whether this antenna can be inherited (bred) onto offspring. Defaults to false."
      },
      "evolvesToId": {
        "type": ["string", "null"],
        "description": "Antenna id this one evolves into, or null/omitted if it has no evolution."
      },
      "maxLevel": {
        "type": ["integer", "null"],
        "description": "Highest level (shown as a \"+N\" suffix in-game) this variant's name applies through before evolving via evolvesToId, or null/omitted if it doesn't level-evolve."
      },
      "variantGroupId": {
        "type": ["string", "null"],
        "description": "Groups this variant together with its sibling target-pattern variants (e.g. 1-target/3-target/all-target of the same base move), selectable via a separate pattern slider in the selection dialog. Null/omitted if this antenna has only one pattern."
      },
      "hasLevel": {
        "type": "boolean",
        "description": "Whether this antenna exposes a level slider (\"+N\" suffix) in the selection dialog. Defaults to true; set to false for antennas with no upgradeable level, such as antennaRoot."
      }
    }
  }
}
