[
  {
    "id": "harden_solo_1",
    "category": "support",
    "targetCount": 1,
    "maxLevel": null,
    "evolvesToId": "harden_solo_2",
    "variantGroupId": "harden"
  },
  {
    "id": "harden_solo_2",
    "category": "support",
    "targetCount": 1,
    "maxLevel": null,
    "evolvesToId": "harden_solo_3",
    "variantGroupId": "harden"
  },
  {
    "id": "harden_solo_3",
    "category": "support",
    "targetCount": 1,
    "maxLevel": null,
    "variantGroupId": "harden"
  },
  {
    "id": "harden_all_1",
    "category": "support",
    "targetsAll": true,
    "maxLevel": null,
    "evolvesToId": "harden_all_2",
    "variantGroupId": "harden"
  },
  {
    "id": "harden_all_2",
    "category": "support",
    "targetsAll": true,
    "maxLevel": null,
    "evolvesToId": "harden_all_3",
    "variantGroupId": "harden"
  },
  {
    "id": "harden_all_3",
    "category": "support",
    "targetsAll": true,
    "maxLevel": null,
    "variantGroupId": "harden"
  }
]
