[
  {
    "id": "beam_1",
    "category": "attack",
    "targetCount": 1,
    "dealsDamage": true,
    "variantGroupId": "beam"
  },
  {
    "id": "beam_3",
    "category": "attack",
    "targetCount": 3,
    "dealsDamage": true,
    "variantGroupId": "beam"
  },
  {
    "id": "beam_all",
    "category": "attack",
    "targetsAll": true,
    "dealsDamage": true,
    "variantGroupId": "beam"
  }
]
