[
  {
    "id": "staticElectricity_1",
    "category": "attack",
    "targetCount": 1,
    "dealsDamage": true,
    "attackAttributeIds": ["thunder"],
    "variantGroupId": "staticElectricity"
  },
  {
    "id": "staticElectricity_3",
    "category": "attack",
    "targetCount": 3,
    "dealsDamage": true,
    "attackAttributeIds": ["thunder"],
    "variantGroupId": "staticElectricity"
  },
  {
    "id": "staticElectricity_all",
    "category": "attack",
    "targetsAll": true,
    "dealsDamage": true,
    "attackAttributeIds": ["thunder"],
    "variantGroupId": "staticElectricity"
  }
]
