[
  {
    "id": "waterGun_1",
    "category": "attack",
    "targetCount": 1,
    "dealsDamage": true,
    "attackAttributeIds": ["water"],
    "variantGroupId": "waterGun"
  },
  {
    "id": "waterGun_3",
    "category": "attack",
    "targetCount": 3,
    "dealsDamage": true,
    "attackAttributeIds": ["water"],
    "variantGroupId": "waterGun"
  },
  {
    "id": "waterGun_all",
    "category": "attack",
    "targetsAll": true,
    "dealsDamage": true,
    "attackAttributeIds": ["water"],
    "variantGroupId": "waterGun"
  }
]
