[
  {
    "id": "darkBall_1",
    "category": "attack",
    "targetCount": 1,
    "dealsDamage": true,
    "attackAttributeIds": ["dark"],
    "variantGroupId": "darkBall"
  },
  {
    "id": "darkBall_3",
    "category": "attack",
    "targetCount": 3,
    "dealsDamage": true,
    "attackAttributeIds": ["dark"],
    "variantGroupId": "darkBall"
  },
  {
    "id": "darkBall_all",
    "category": "attack",
    "targetsAll": true,
    "dealsDamage": true,
    "attackAttributeIds": ["dark"],
    "variantGroupId": "darkBall"
  }
]
