[
  {
    "id": "slowDown_solo_1",
    "category": "support",
    "targetCount": 1,
    "hasLevel": false,
    "evolvesToId": "slowDown_solo_2",
    "variantGroupId": "slowDown"
  },
  {
    "id": "slowDown_solo_2",
    "category": "support",
    "targetCount": 1,
    "hasLevel": false,
    "evolvesToId": "slowDown_solo_3",
    "variantGroupId": "slowDown"
  },
  {
    "id": "slowDown_solo_3",
    "category": "support",
    "targetCount": 1,
    "hasLevel": false,
    "variantGroupId": "slowDown"
  },
  {
    "id": "slowDown_all_1",
    "category": "support",
    "targetsAll": true,
    "hasLevel": false,
    "evolvesToId": "slowDown_all_2",
    "variantGroupId": "slowDown"
  },
  {
    "id": "slowDown_all_2",
    "category": "support",
    "targetsAll": true,
    "hasLevel": false,
    "evolvesToId": "slowDown_all_3",
    "variantGroupId": "slowDown"
  },
  {
    "id": "slowDown_all_3",
    "category": "support",
    "targetsAll": true,
    "hasLevel": false,
    "variantGroupId": "slowDown"
  }
]
