[
  {
    "id": "whirlwind_1",
    "category": "attack",
    "targetCount": 1,
    "dealsDamage": true,
    "attackAttributeIds": ["wind"],
    "variantGroupId": "whirlwind"
  },
  {
    "id": "whirlwind_3",
    "category": "attack",
    "targetCount": 3,
    "dealsDamage": true,
    "attackAttributeIds": ["wind"],
    "variantGroupId": "whirlwind"
  },
  {
    "id": "whirlwind_all",
    "category": "attack",
    "targetsAll": true,
    "dealsDamage": true,
    "attackAttributeIds": ["wind"],
    "variantGroupId": "whirlwind"
  }
]
